key,author,year,citation,URL
AH97b,"J. P. Amend and H. C. Helgeson",1997,"J. Chem. Soc., Faraday Trans. 93, 1927-1941",http://dx.doi.org/10.1039/A608126F
AML10,"M. Accornero, L. Marini and M. Lelli",2010,"Appl. Geochem. 25, 242-260",http://dx.doi.org/10.1016/j.apgeochem.2009.11.010
AP01,"J. P. Amend and A. V. Plyasunov",2001,"Geochim. Cosmochim. Acta 65, 3901-3917",http://dx.doi.org/10.1016/S0016-7037(01)00707-4
AS01,"J. P. Amend and E. L. Shock",2001,"FEMS Microbiol. Rev. 25, 175-243",http://dx.doi.org/10.1016/S0168-6445(00)00062-0
BH83a,"T. S. Bowers and H. C. Helgeson",1983,"Geochim. Cosmochim. Acta 47, 1247-1275",http://dx.doi.org/10.1016/0016-7037(83)90066-2
CHNOSZ,"J. M. Dick",2007,"CHNOSZ package documentation",http://chnosz.net
CS16,"P. A. Canovas III and E. L. Shock",2016,"Geochim. Cosmochim. Acta 195, 293-322",http://dx.doi.org/10.1016/j.gca.2016.08.028
CWM89,"J. D. Cox, D. D. Wagman and V. A. Medvedev, eds.",1989,"CODATA Key Values for Thermodynamics",http://www.worldcat.org/oclc/18559968
DEH+13,"J. M. Dick, K. A. Evans et al.",2013,"Geochim. Cosmochim. Acta 122, 247-266",http://dx.doi.org/10.1016/j.gca.2013.08.020
DLH06,"J. M. Dick, D. E. LaRowe and H. C. Helgeson",2006,"Biogeosciences 3, 311-336",http://dx.doi.org/10.5194/bg-3-311-2006
DSM+97,"J. D. Dale, E. L. Shock et al.",1997,"Geochim. Cosmochim. Acta 61, 4017-4024",http://dx.doi.org/10.1016/S0016-7037(97)00212-3
Dic07,"J. M. Dick",2007,"Ph.D. Dissertation, U.C. Berkeley",
GM09,"K.-D. Grevel and J. Majzlan",2009,"Geochim. Cosmochim. Acta 73, 6805 - 6815",http://dx.doi.org/10.1016/j.gca.2009.08.005
Gur96,"S. Gurrieri",1996,"personal communication",
HDN+78,"H. C. Helgeson, J. M. Delany et al.",1978,"Am. J. Sci. 278A, 1-229",http://www.worldcat.org/oclc/13594862
Hel85b,"H. C. Helgeson",1985,"Am. J. Sci. 285, 845-855",http://dx.doi.org/10.2475/ajs.285.9.845
HOK+98,"H. C. Helgeson, C. E. Owens et al.",1998,"Geochim. Cosmochim. Acta 62, 985-1081",http://dx.doi.org/10.1016/S0016-7037(97)00219-6
HPT06,"B. Hawrylak, R. Palepu and P. R. Tremaine",2006,"J. Chem. Thermodynamics 38, 988-1007",http://dx.doi.org.ezproxy1.lib.asu.edu/10.1016/j.jct.2005.10.013
HRM+09,"H. C. Helgeson, L. Richard et al.",2009,"Geochim. Cosmochim. Acta 73, 594-695",http://dx.doi.org/10.1016/j.gca.2008.03.004
HS99,"J. R. Haas and E. L. Shock",1998,"Geochim. Cosmochim. Acta 63, 3429-3441",http://dx.doi.org/10.1016/S0016-7037(99)00276-8
HSS95,"J. R. Haas, E. L. Shock and D. C. Sassani",1995,"Geochim. Cosmochim. Acta 59, 4329-4350",http://dx.doi.org/10.1016/0016-7037(95)00314-P
JH85b,"K. J. Jackson and H. C. Helgeson",1985,"Econ. Geol. 80, 1365-1378",http://dx.doi.org/10.2113/gsecongeo.80.5.1365
Joh92,"J. W. Johnson",1992,"personal communication",
Kel60,"K. K. Kelley",1960,"U. S. Bureau of Mines Bull. 584",http://www.worldcat.org/oclc/693388901
LD12,"D. E. LaRowe and J. M. Dick",2012,"Geochim. Cosmochim. Acta 80, 70-91",http://10.1016/j.gca.2011.11.041
LH06a,"D. E. LaRowe and H. C. Helgeson",2006,"Geochim. Cosmochim. Acta 70, 4680-4724",http://dx.doi.org/10.1016/j.gca.2006.04.010
LH06b,"D. E. LaRowe and H. C. Helgeson",2006,"Thermochim. Acta 448, 82-106",http://dx.doi.org/10.1016/j.tca.2006.06.008
MA07,"L. Marini and M. Accornero",2007,"Environ. Geol. 52, 1343-1363",http://dx.doi.org/10.1007/s00254-006-0578-5
MA10,"L. Marini and M. Accornero",2010,"Environ. Earth Sci. 59, 1601-1606",http://dx.doi.org/10.1007/s12665-009-0369-x
MGN03,"J. Majzlan, K.-D. Grevel and A. Navrotsky",2003,"Am. Mineral. 88, 855-859",http://dx.doi.org/10.2138/am-2003-5-614
MLS+03,"J. Majzlan, B. E. Lang et al.",2003,"Am. Mineral. 88, 846-854",http://dx.doi.org/10.2138/am-2003-5-613
MNM+06,"J. Majzlan, A. Navrotsky et al.",2006,"Eur. J. Mineral. 18, 175-186",http://dx.doi.org/10.1127/0935-1221/2006/0018-0175
MS97,"T. M. McCollom and E. L. Shock",1997,"Geochim. Cosmochim. Acta 61, 4375-4391",http://dx.doi.org/10.1016/S0016-7037(97)00241-X
MSB+04,"J. Majzlan, R. Stevens et al.",2004,"Phys. Chem. Mineral. 31, 518-531",http://dx.doi.org/10.1007/s00269-004-0405-z
MVT01,"L. Mercury, P. Vieillard. and Y. Tardy",2001,"Appl. Geochem. 16, 161-181",http://dx.doi.org/10.1016/S0883-2927(00)00025-1
Nei86,"F. C. Neidhardt",1986,"Escherichia coli and Salmonella typhimurium, 3-5",http://www.worldcat.org/oclc/15280827
Pan70,"L. B. Pankratz",1970,"U. S. Bureau of Mines Report of Investigations 7430",http://www.worldcat.org/oclc/14154245
PB82,"L. N. Plummer and E. Busenberg",1982,"Geochim. Cosmochim. Acta 46, 1011-1040",http://dx.doi.org/10.1016/0016-7037(82)90056-4
PK70,"L. B. Pankratz and E. G. King",1970,"U. S. Bureau of Mines Report of Investigations 7435",http://www.worldcat.org/oclc/14154292
PK95,"V. B. Parker and I. L. Khodakovskii",1995,"J. Phys. Chem. Ref. Data 24, 1699-1745",http://dx.doi.org/10.1063/1.555964
PS01,"A. V. Plyasunov and E. L. Shock",2001,"Geochim. Cosmochim. Acta 65, 3879-3900",http://dx.doi.org/10.1016/S0016-7037(01)00678-0
PSK99,"P. Prapaipong, E. L. Shock and C. M. Koretsky",1999,"Geochim. Cosmochim. Acta 63, 2547-2577",http://dx.doi.org/10.1016/S0016-7037(99)00146-5
RG11,"L. Richard and X. Gaona",2011,"Geochim. Cosmochim. Acta 75, 7304-7350",http://dx.doi.org/10.1016/j.gca.2011.07.030
RH95,"R. A. Robie and B. S. Hemingway",1995,"U. S. Geological Survey Bull. 2131",http://pubs.er.usgs.gov/publication/b2131
RH98,"L. Richard and H. C. Helgeson",1998,"Geochim. Cosmochim. Acta 62, 3591-3636",http://dx.doi.org/10.1016/S0016-7037(97)00345-1
RHF79,"R. A. Robie, B. S. Hemingway and J. R. Fisher",1979,"U. S. Geological Survey Bull. 1452",http://pubs.er.usgs.gov/publication/b1452
Ric01,"L. Richard",2001,"Geochim. Cosmochim. Acta 65, 3827-3877",http://dx.doi.org/10.1016/S0016-7037(01)00761-X
Ric08,"L. Richard",2008,"personal communication",
SAJ00,"R. E. Stoffregen, C. N. Alpers and J. L. Jambor",2000,"Rev. Mineral. Geochem. 40, 453-479",http://dx.doi.org/10.2138/rmg.2000.40.9
Sch10,"M. Schulte",2010,"Aquat. Geochem. 16, 621-637",http://dx.doi.org/10.1007/s10498-010-9102-3
SH88,"E. L. Shock and H. C. Helgeson",1988,"Geochim. Cosmochim. Acta 52, 2009-2036",http://dx.doi.org/10.1016/0016-7037(88)90181-0
SH90,"E. L. Shock and H. C. Helgeson",1990,"Geochim. Cosmochim. Acta 54, 915-945",http://dx.doi.org/10.1016/0016-7037(90)90429-O
Sho92,"E. L. Shock",1992,"Geochim. Cosmochim. Acta 56, 3481-3491",http://dx.doi.org/10.1016/0016-7037(92)90392-V
Sho93,"E. L. Shock",1993,"Geochim. Cosmochim. Acta 57, 3341-3349",http://dx.doi.org/10.1016/0016-7037(93)90542-5
Sho95,"E. L. Shock",1990,"Am. J. Sci. 295, 496-580",http://dx.doi.org/10.2475/ajs.295.5.496
SHS89,"E. L. Shock, H. C. Helgeson and D. A. Sverjensky",1989,"Geochim. Cosmochim. Acta 53, 2157-2183",http://dx.doi.org/10.1016/0016-7037(89)90341-4
SK93,"E. L. Shock and C. M. Koretsky",1993,"Geochim. Cosmochim. Acta 57, 4899-4922",http://dx.doi.org/10.1016/0016-7037(93)90128-J
SK95,"E. L. Shock and C. M. Koretsky",1995,"Geochim. Cosmochim. Acta 59, 1497-1532",http://dx.doi.org/10.1016/0016-7037(95)00058-8
SLOP98,"E. L. Shock et al.",1998,"slop98.dat computer data file",http://geopig.asu.edu/?q=tools
SM93,"E. L. Shock and W. B. McKinnon",1993,"Icarus 106, 464-477",http://dx.doi.org/10.1006/icar.1993.1185
SR04,"M. D. Schulte and K. L. Rogers",2004,"Geochim. Cosmochim. Acta 68, 1087-1097",http://dx.doi.org/10.1016/j.gca.2003.06.001
SS93,"M. D. Schulte and E. L. Shock",1993,"Geochim. Cosmochim. Acta 57, 3835-3846",http://dx.doi.org/10.1016/0016-7037(93)90337-V
SS98,"D. C. Sassani and E. L. Shock",1998,"Geochim. Cosmochim. Acta 62, 2643-2671",http://dx.doi.org/10.1016/S0016-7037(98)00049-0
SSB97,"E. L. Shock, D. C. Sassani and H. Betz",1997,"Geochim. Cosmochim. Acta 61, 4245-4266",http://dx.doi.org/10.1016/S0016-7037(97)00240-8
SSH97,"D. A. Sverjensky, E. L. Shock and H. C. Helgeson",1997,"Geochim. Cosmochim. Acta 61, 1359-1412",http://dx.doi.org/10.1016/S0016-7037(97)00009-4
SSW+97,"E. L. Shock, D. C. Sassani et al.",1997,"Geochim. Cosmochim. Acta 61, 907-950",http://dx.doi.org/10.1016/S0016-7037(96)00339-0
SSW01,"M. D. Schulte, E. L. Shock and R. H. Wood",2001,"Geochim. Cosmochim. Acta 65, 3919-3930",http://dx.doi.org/10.1016/S0016-7037(01)00717-7
TSD97,"Y. Tardy, R. Schaul, J. Duplay",1997,"C. R. Acad. Sci. Paris 324, 969-976",http://dx.doi.org/10.1016/S1251-8050(97)83981-X
UniProt,"The UniProt Consortium",2017,"The UniProt knowledgebase",http://www.uniprot.org/
WEP+82,"D. D. Wagman, W. H. Evans et al.",1982,"J. Phys. Chem. Ref. Data 11, 1-392",http://dx.doi.org/10.1063/1.555661
